{
  "schemaVersion": 1,
  "selectedAccountId": "",
  "selectedProfileId": "Bedwars",
  "allocatedRamMb": 3072,
  "javaPath": "",
  "customJvmArgs": "-XX:+UseG1GC -XX:+UnlockExperimentalVMOptions -XX:G1NewSizePercent=20 -XX:G1ReservePercent=20 -XX:MaxGCPauseMillis=50 -XX:G1HeapRegionSize=32M",
  "closeLauncherOnGameStart": true,
  "enableHardwareAcceleration": true,
  "autoCheckUpdates": true,
  "releaseChannel": "stable",
  "gameResolutionWidth": 1920,
  "gameResolutionHeight": 1080
}
